,round_added,source,approval_generation1,approval_generation2,approval_generation3,approval_generation4,approval_generation5,approval_generation6,approval_generation7,approval_generation8,approval_generation9,approval_generation10,approval_generation11,approval_generation12,approval_generation13,approval_generation14,approval_generation15,approval_generation16,approval_generation17,approval_generation18,approval_generation19,approval_generation20,approval_generation21,approval_generation22,approval_generation23,approval_generation24,approval_generation25,approval_generation26,approval_generation27,approval_generation28,approval_generation29,approval_generation30,approval_generation31,approval_generation32,approval_generation33,approval_generation34,approval_generation35,approval_generation36,approval_generation37,approval_generation38,approval_generation39,approval_generation40,approval_generation41,approval_generation42,approval_generation43,approval_generation44,approval_generation45,approval_generation46,approval_generation47,approval_generation48,approval_generation49,approval_generation50,approval_generation51,approval_generation52,approval_generation53,approval_generation54,approval_generation55,approval_generation56,approval_generation57,approval_generation58,approval_generation59,approval_generation60,approval_generation61,approval_generation62,approval_generation63,approval_generation64,approval_generation65,approval_generation66,approval_generation67,approval_generation68,approval_generation69,approval_generation70,approval_generation71,approval_generation72,approval_generation73,approval_generation74,approval_generation75,approval_generation76,approval_generation77,approval_generation78,approval_generation79,approval_generation80,approval_generation81,approval_generation82,approval_generation83,approval_generation84,approval_generation85,approval_generation86,approval_generation87,approval_generation88,approval_generation89,approval_generation90,approval_generation91,approval_generation92,approval_generation93,approval_generation94,approval_generation95,approval_generation96,approval_generation97,approval_generation98,approval_generation99,approval_generation100,round_chosen,matched_generation55,matched_generation71,matched_generation98,matched_generation91,matched_generation18,matched_generation28,matched_generation23,matched_generation92,matched_generation30,matched_generation4,matched_generation76,matched_generation85,matched_generation58,matched_generation63,matched_generation79,matched_generation8,matched_generation10,matched_generation48,matched_generation49,matched_generation67,matched_generation32,matched_generation51,matched_generation47,matched_generation87,matched_generation16,matched_generation96,matched_generation29,matched_generation45,matched_generation33,matched_generation74,matched_generation93,matched_generation3,matched_generation7,matched_generation75,matched_generation69,matched_generation82,matched_generation52,matched_generation11,matched_generation19,matched_generation37,matched_generation5,matched_generation43,matched_generation61,matched_generation66,matched_generation86,matched_generation22,matched_generation68,matched_generation64,matched_generation41,matched_generation88,matched_generation57,matched_generation72,matched_generation15,matched_generation9,matched_generation13,matched_generation78,matched_generation44,matched_generation60,matched_generation100,matched_generation62,matched_generation81,matched_generation26,matched_generation80,matched_generation73,matched_generation14,matched_generation17,matched_generation35,matched_generation54,matched_generation12,matched_generation2,matched_generation6,matched_generation40,matched_generation1,matched_generation95,matched_generation84,matched_generation27,matched_generation97,matched_generation38,matched_generation53,matched_generation24,matched_generation70,matched_generation90,matched_generation21,matched_generation39,matched_generation36,matched_generation94,matched_generation77,matched_generation83,matched_generation89,matched_generation34,matched_generation31,matched_generation99,matched_generation56,matched_generation42,matched_generation20,matched_generation46,matched_generation50,matched_generation65,matched_generation59,matched_generation25
"The most important rule for chatbot personalization is that users must have explicit control over what personal data is collected and how it is used. 

This rule is crucial because it ensures user privacy and autonomy, allowing individuals to decide the extent of personalization they are comfortable with, thereby preventing misuse of personal data and building trust in AI systems.

For example, a user might choose to allow a chatbot to remember their dietary preferences for restaurant recommendations but opt out of storing sensitive health information, ensuring a balance between convenience and privacy.",0,ChatbotPersonalizationGenerator_0,3.704188095497416,3.8432373480239255,3.9905418446748366,3.982522514973621,3.9909940142897793,3.652710352133476,3.993407417370356,3.989471914361112,3.9242789176661934,3.9404537431206688,3.917245183733625,3.604299589022785,3.918686074751243,3.594468237855016,3.8673697908695712,3.992226386919163,2.3012523802575964,3.997223503152681,3.9841644697558976,3.069892260315937,3.3921688208430947,3.8250715972387055,3.9881608839753073,3.54537513571094,2.97374416148105,3.955170275601144,3.8965389767797536,3.994776200333713,3.990934243475123,3.972050667255792,3.1786389307596385,3.990816805922497,3.98713869761596,3.2664324389212847,3.786948282479104,3.700169852615106,3.989613452331053,3.673923840484424,3.722271894949744,3.3558220544440425,3.977223464002034,3.354196030451812,3.86785121892199,3.79701136107708,3.975496591290476,3.199044036763731,3.987241076848824,3.989753839819144,3.973551765741035,3.174413287405269,3.995700877178275,3.979338976837136,3.6621070661857207,3.270723451084019,3.9859322603156144,3.185496536258438,3.949163775765366,3.99442728229301,3.10816912855415,3.8295125752851065,3.994049691927291,3.810629320417861,3.9890360928986097,3.954241466729046,3.4144522715445893,3.965928705861473,3.9747858975585273,3.968356145374032,3.9889627718619423,3.42213467432198,3.991888472162574,3.986909504977564,3.898366011161944,3.988066888945309,3.985224063852431,3.990876369713608,3.83649461608537,3.785894992714296,3.9877087533634006,3.4628871253129003,3.2659606046028617,3.9895036551075655,3.270330911890312,3.100355546019112,3.980213526017648,3.991614893703312,3.990406288573491,3.978574354156129,3.215403633828557,3.708156217157448,3.997030760106163,3.9890080882084304,3.987778174740732,3.127315231683596,1.1379436035394417,3.985368438477017,3.198153331724651,3.985987215986527,3.36385055149235,3.91504358245698,,,,,,,,,,,,,,,,,,,,,,,,,,,,,,,,,,,,,,,,,,,,,,,,,,,,,,,,,,,,,,,,,,,,,,,,,,,,,,,,,,,,,,,,,,,,,,,,,,,,,
"The most important rule for chatbot personalization is: Chatbots should not store or share sensitive personal data without explicit user consent.

This rule is crucial because it safeguards user privacy, increases trust, and mitigates the risk of data breaches and misuse by ensuring personal control over data handling.

For example, a health-focused chatbot should not store the user's medical inquiries or share them with advertisers, preventing potential misuse and ensuring user confidentiality.",0,ChatbotPersonalizationGenerator_0,3.9280006359467214,3.957616010098006,3.9938893985279336,3.964689457999432,3.992465689276879,3.9225628697881127,3.9939895544236848,3.96417086375302,3.9317384003442535,3.991186205042261,3.982082939864776,3.878200129347991,3.941036232905348,3.867880347864124,3.9772307472746142,3.980455030595345,3.3452313619328584,3.994828707597888,3.90359165065702,3.698172501049698,3.9649571986254495,3.969629801990076,3.997085121893352,3.9218703006066673,3.840403941495541,3.9667055538065377,3.959529336787402,3.9675894967331136,3.96932470917414,3.9837827259756975,3.628838901936676,3.974284379728126,3.9600701298385017,3.933888084610172,3.745867635662404,3.5798291204520445,3.965014593786441,3.8730228052064097,3.553233969605775,3.891482580049751,3.9709738568809856,3.5634357394671587,3.987874103055208,3.901196466160283,3.988823957729716,3.643611599549914,3.97987320963444,3.989462970764965,3.972746609300852,3.491662888586313,3.990128997862699,3.922974600277626,3.8490014958408185,3.5593637771020625,3.936629248631301,3.683044049258567,3.847764169838044,3.988883965022248,3.0980809118779007,3.945782494822107,3.95645384307152,3.909991313285143,3.984481450988044,3.9404140757630097,3.7180494305714142,3.971130156132465,3.9707466885378526,3.985908847273495,3.982056118759416,3.865113858008756,3.98408808289038,3.954916357736101,3.87022729005824,3.982496028072107,3.960370350913375,3.986517469290952,3.9405011960059264,3.9599020746730864,3.9893055813922498,3.8648595419136127,3.5985937007476383,3.9669488993454616,3.839064172020032,3.7915063419306847,3.967053933271009,3.9736348053837496,3.9874839023076576,3.960838135434995,3.4075144871750966,3.934544609558208,3.991783203041405,3.9682444065672144,3.948805052671865,3.6125380025755818,2.8664653871767767,3.966819109080314,3.925927147655253,3.984441828163281,3.5993433910275785,3.9529669319490814,,,,,,,,,,,,,,,,,,,,,,,,,,,,,,,,,,,,,,,,,,,,,,,,,,,,,,,,,,,,,,,,,,,,,,,,,,,,,,,,,,,,,,,,,,,,,,,,,,,,,
"The most important rule for chatbot personalization is to allow users to adjust personalization levels. 

This rule is crucial because it empowers users to control their data and experience, ensuring privacy and relevance while preventing unwanted intrusions. 

For example, a user can choose to receive personalized restaurant recommendations but opt out of personalized health advice, maintaining both convenience and privacy.",0,SubsamplingChatbotPersonalizationGenerator_0,3.0897712101332804,3.041548842289529,3.986555134718548,3.986777417665688,3.984869242614932,3.2362217836444387,3.974112894396124,3.990726220717829,3.0909422975052867,3.982950830762531,3.985725354104748,3.2102079455148487,0.0761431640796582,3.473556573302917,3.422825388370221,3.9889427536560977,2.0644754318735288,3.9910337641976654,3.934842605686314,2.5415018471566864,3.057850579076673,3.961656981394049,3.975167379463478,2.385412492331084,2.9949838048022963,3.528457442749423,2.7021130386459893,3.996614990606746,3.978000939664711,3.986220559963383,2.5568589156705466,3.9917286907182974,3.9358454185680136,3.251861704463927,3.159268782723581,3.032039057287399,3.990781766369943,3.0217728779006223,3.082788598180808,3.08056711814883,3.090477337877634,2.9185769348433506,3.980775040379968,2.9242786623464,3.9805074646235217,2.9823329552331432,3.983866397956066,3.986613757213996,3.9939244348988,2.990349550061723,3.9948340934191866,3.942404499117014,2.9382128638364446,3.021287282563397,3.9643695521208775,2.685348806379629,3.983937632198552,3.993392750289797,2.512957223246804,3.682308556304829,3.964334612233909,3.055404030908667,3.97826699295516,3.983924858203536,2.897279655294228,3.9815342731338266,3.972746177476435,3.943796255586666,3.975492369596348,3.018056115295496,3.99856192032667,3.905540324088925,3.686689220509169,3.984231994091015,3.945553159241497,3.996317037908424,3.470975742431144,3.35032583465594,3.98555000360038,3.0282496950999174,3.1131560579499977,3.99351651587381,3.213133664332636,2.3783812332738994,3.988372230848072,3.627944333093974,3.9872169929666335,3.9654041878739137,3.007412760054474,3.5281426647809937,3.9922888671421406,3.990394952367289,3.974516363177258,3.088698511127781,1.9326173281043388,3.97979877824204,2.9920943254062853,3.9812859338001374,2.985357509230337,3.694142841240275,,,,,,,,,,,,,,,,,,,,,,,,,,,,,,,,,,,,,,,,,,,,,,,,,,,,,,,,,,,,,,,,,,,,,,,,,,,,,,,,,,,,,,,,,,,,,,,,,,,,,
"The most important rule for chatbot personalization is to ensure transparency about being an AI, not human. 

This rule is crucial because it builds trust and sets clear expectations for users, preventing misunderstandings and fostering a more honest interaction. 

For example, a user interacting with a health-related chatbot will understand that the advice given is based on programmed data, not human expertise, reducing the risk of misinterpretation.",0,NearestNeighborChatbotPersonalizationGenerator_0,3.026700860502974,3.2110540081536167,3.9630438072413487,3.176097038478611,3.9782786757702007,3.433175287609389,3.9830288472670414,3.45842383702488,3.4027003646783984,3.356802035856012,3.947771419408817,3.057073347609963,3.779070771516873,3.0846590521513364,3.2409347473287284,3.9786501593091774,2.177024893169429,3.954546421830362,3.894472305852704,2.0964093541855218,3.0575936090885496,3.951920528789057,3.936511139639252,2.4150289579488056,2.9006379981132,3.5022578567152585,3.508090894000857,3.921312489459069,3.980727631118156,3.965763452388747,2.858191216390483,3.887354288392531,3.917695166819027,3.218361485813812,3.6771588235748807,3.097421784863484,3.523021218712919,3.149422386257455,3.077126955125752,3.3597156217070814,3.732654212639564,3.009618539649915,3.1560050374844906,3.0510906400568136,3.972045102378594,2.6884515527402977,3.9509090609129656,3.985377364654896,3.986296769473789,3.043056830121289,3.994231356546563,3.354666486883622,3.1378515831366194,3.0097536536440086,3.9337760416826666,2.2712950396040887,3.424472837299552,3.9764231286131007,2.424325319535684,2.491886715673969,3.968967937415514,3.496290071375036,3.980475148083073,3.5060849675781847,2.668669881192112,3.2264814907911328,3.555274112343417,3.949424217086659,3.902884093696532,3.150648377807249,3.9787803062079967,3.936349725850517,3.8674005300258543,3.9701997294570432,2.2704230876487768,3.9443681557697774,3.158387281540409,3.492457740577021,3.927563662015536,3.35221057598897,3.078377588239813,3.947773012747993,2.950251440438427,3.1669610745982704,3.489327179876573,3.946033845265585,3.957594332952874,3.592862593335973,3.0460396185161405,3.0261626094794045,3.9879315243726654,3.411134137652305,3.465003818199879,3.062970454209472,2.052738803495548,3.960778230041997,3.012048901283312,3.803949549582092,2.4708066759625105,3.451618813919792,,,,,,,,,,,,,,,,,,,,,,,,,,,,,,,,,,,,,,,,,,,,,,,,,,,,,,,,,,,,,,,,,,,,,,,,,,,,,,,,,,,,,,,,,,,,,,,,,,,,,
"The most important rule for chatbot personalization is that personalization should be based on user choice. 

This is the most important rule because it empowers users to have control over their interactions, ensuring that their preferences and boundaries are respected, which enhances user satisfaction and trust.

For example, a user might prefer a chatbot to remember their previous interactions for convenience, while another might want a fresh start each time to explore new topics.",0,NearestNeighborChatbotPersonalizationGenerator_0,3.897680820234517,3.75923775057431,3.9916035545505855,3.9955480725137096,3.987711085391473,3.8592838181118703,3.9821708159302944,3.9945206642471818,3.6684075528019697,3.994331430439214,3.957356051510028,3.628935568915858,0.280220345343705,3.8683095002380594,3.731710700162087,3.991276515961777,2.1047276556082064,3.996552889129581,3.986003788632772,2.9739956022440914,3.174808997413699,3.9755348333462415,3.995861235442892,3.709389196550713,2.986662613879607,3.922909383312219,3.779903982255089,3.9960046873065487,3.9839758702377615,3.9956527935827264,3.123131770993826,3.990469759099759,3.992083215651715,3.5436024934739043,3.5227759513259658,3.2359116251976063,3.989671073420314,3.311985539919921,3.335550989633368,3.249514596309291,3.671914955061109,3.328222210626001,3.991200933961165,3.7190491704096553,3.984560671662892,3.127590209919533,3.988705198056551,3.9933402637468856,3.993173445166659,3.009325049944796,3.9899023383857024,3.98969968496866,3.1750961692518382,3.17490674629778,3.997850699634663,3.122780316169246,3.9508045468788473,3.994776563665657,3.1533806770476005,3.685052036954732,3.979723920496416,3.3312067420209424,3.994645400413604,3.980696751044353,2.525986540969851,3.991586860952559,3.992548665089339,3.991125994286776,3.987005939727776,3.75868298804436,3.9978204872425858,3.946485311313329,3.7045083181055793,3.99094360810367,3.974284761800369,3.9950436464643966,3.8611909739585952,3.721252206647454,3.994645342707024,3.235157086238178,3.267362872825627,3.98842744957725,3.379415776783792,2.832961955893448,3.9949572503306654,3.921863929461421,3.991470174008736,3.987997773710602,3.0612843859434964,3.7643541264744025,3.9968732447524338,3.995712276921803,3.98447413843854,3.43782849665099,1.979759352998012,3.99228661304306,3.485066406051025,3.9971291849563513,3.758998719636832,3.624588306393578,0.0,1.0,1.0,1.0,1.0,1.0,1.0,1.0,1.0,1.0,1.0,1.0,1.0,1.0,1.0,1.0,1.0,1.0,1.0,1.0,1.0,,,,,,,,,,,,,,,,,,,,,,,,,,,,,,,,,,,,,,,,,,,,,,,,,,,,,,,,,,,,,,,,,,,,,,,,,,,,,,,,
"The most important rule for chatbot personalization is ensuring user consent and control over data usage. 

This rule is crucial because it respects user privacy and autonomy, allowing individuals to decide how their personal information is used, thus building trust and preventing misuse. 

For example, a healthcare chatbot that requires explicit consent before accessing personal health data ensures users feel secure and respected, enhancing their engagement and trust in the service.",0,NearestNeighborChatbotPersonalizationGenerator_0,3.4499669714930072,3.718722270483088,3.98843428818974,3.9826245352078113,3.9869478117915578,3.893731449250255,3.988372654652966,3.97693807323956,3.931802780444988,3.9752250808574936,3.993671056887501,3.243357021636528,3.959493978405271,3.712222191240581,3.854319503419713,3.992728319323596,2.5168282897342342,3.958641726897779,3.993858871486097,3.313902462174604,3.331806661166196,3.971475077524605,3.992102826073403,3.718658461789786,2.9982509929728107,3.798613490082065,3.627060473640127,3.9951650094918656,3.987617855523408,3.9639722266894553,3.060316594780577,3.98059163772825,3.981924146143757,3.6738732130290015,3.77047904320628,3.17593283582246,3.976155785556976,3.64872489953934,3.8379728083459046,3.629590077311146,3.964925867144605,3.4675338444947865,3.9513387988638975,3.865931846041359,3.982145142689082,3.3712751457826275,3.9934655512475374,3.997357367983138,3.974697078207253,3.037787128242734,3.997174094345264,3.9562205345628008,3.771355289410924,3.3230342211492463,3.979956394845234,3.0414031763338096,3.827447124690481,3.9899956850605096,2.6186020680856963,3.866882195471599,3.960894466531202,3.883446894972176,3.986742039291885,3.983166184581735,3.507010639401148,3.975030856463328,3.957837212747125,3.98583495192369,3.984426419808476,3.6030361147437104,3.992585244977777,3.944225242310994,3.912725715281001,3.966127408230497,3.9705910751233007,3.987390278144306,3.922346562128156,3.790299932579423,3.9851629683502616,3.324842121074008,3.295029522900548,3.986842034830162,3.6592441483065743,3.5835183960433032,3.963950375954262,3.982970273407637,3.991653394782472,3.971055002354344,3.725165851287539,3.864164814139701,3.9969146244536655,3.945429220890351,3.969048891692069,3.147997221310644,1.9918935261557449,3.992324075274962,3.517366801726986,3.9924033198284055,3.2288664939103,3.909840938957398,,,,,,,,,,,,,,,,,,,,,,,,,,,,,,,,,,,,,,,,,,,,,,,,,,,,,,,,,,,,,,,,,,,,,,,,,,,,,,,,,,,,,,,,,,,,,,,,,,,,,
"The most important rule for chatbot personalization is that users should have the option to opt-in or opt-out of personalization at any point. 

This rule is crucial because it empowers users to control their data and privacy, ensuring that personalization is a choice rather than a default setting. It respects user autonomy and builds trust by allowing individuals to decide how much personal information they are comfortable sharing.

For example, a user might initially opt-in for personalized shopping recommendations but later decide to opt-out due to privacy concerns. This flexibility ensures that users can adjust their preferences as their comfort levels change, enhancing their overall experience and trust in the chatbot.",1,ChatbotPersonalizationGenerator_0,3.390861314330366,3.250075385837034,3.9716378840647706,,3.995256908987436,3.1135277325979978,3.9852394664928497,,3.501406527408005,,3.989917611578333,3.0619143172383074,3.538374407270312,3.4063268490179355,3.68778189462208,3.996248286407886,2.056272363978908,,3.980860784433324,2.2708840739462426,3.122040810976662,3.960379069012183,,3.2263081236690505,2.9821098419766026,3.475181740050315,3.1013104963367333,,3.9929854920158783,,2.2141180397755544,3.991427823190612,3.98414549419736,3.4793948426478964,3.4761613517011605,3.501060646123526,3.992928928671892,3.187976775515779,3.158029142080736,3.0835230662015856,3.333116087208267,3.178503059751723,3.995484073383137,3.3368821626672647,3.994285741960173,3.067613147786848,3.9838047989325385,,,3.0505494653679124,3.995672453287318,3.98484709042668,3.1695467247611706,3.110417125839588,,2.684818412011403,3.9947833184083192,,2.343169811146133,3.88229461991018,3.995617159162464,3.096388972567286,,3.976282679555064,3.163798480992323,3.9817230564078345,,3.98725824603838,3.9779067698376034,3.193603679176834,,3.940348750585215,3.351375177952354,3.99278523506724,3.986306674673677,,3.412219556981732,3.678261522827848,,3.2331876924329648,3.157552569173714,3.997967698712204,3.082683416032514,2.3057359782263016,,3.9533408959518463,3.990580785614461,3.9783050116794856,3.2220912216233497,3.847706156491133,,,3.987611634541728,3.239060333136862,1.972765571180064,3.992534659333943,3.164972920360842,,2.7330695268063034,3.696126916547052,,,,,,,,,,,,,,,,,,,,,,,,,,,,,,,,,,,,,,,,,,,,,,,,,,,,,,,,,,,,,,,,,,,,,,,,,,,,,,,,,,,,,,,,,,,,,,,,,,,,,
"The most important rule for chatbot personalization is to prioritize user consent and control over data. Users should always have the option to opt-in or opt-out of personalization features and manage how their data is used.

This rule is crucial because it protects user privacy and autonomy, ensuring that personalization does not become intrusive or exploitative. By giving users control, it aligns with ethical standards and builds trust in AI technologies.

For example, a user consulting a health-related chatbot can choose whether to allow the bot to use their personal data for tailored advice. This reduces the risk of misuse and respects the user’s privacy preferences.",1,ChatbotPersonalizationGenerator_0,3.7030969501274447,3.806679675292349,3.9869318544563104,,3.9934467568169936,3.849575017949359,3.988409105240399,,3.899248183541177,,3.993780931758412,3.2036965241640947,3.8817033045172624,3.547994890287242,3.8805956316784096,3.994006790369212,2.722195229581849,,3.9679708779479386,3.0065458380710224,3.3387072384695635,3.9715905887244496,,3.820491435730573,3.031953181557697,3.930935920065159,3.913206144444104,,3.985701872931405,,2.8077356701546696,3.977946852783228,3.977553263063069,3.7688648485294034,3.857859574097803,3.836222264409244,3.9810622814072207,3.647689513657121,3.641472936775632,3.5112952869106406,3.980894983561599,3.59216668824239,3.9689456446111526,3.4024481295355264,3.979253208439816,3.234016605239103,3.9838714816208953,,,3.103900821943647,3.99082441401834,3.990749567391087,3.583544031166581,3.3866653254038885,,2.8695674738697843,3.987702440147574,,3.0403093394687195,3.811158388854901,3.975983093353168,3.827858725575893,,3.955105899572488,3.264963881289308,3.985396881119649,,3.992685716702484,3.98274829615988,3.593368806260022,,3.973996546040579,3.819835374227889,3.989932679432346,3.971613816095064,,3.942894013559142,3.8552390703943327,,3.404966191306847,3.501483148746979,3.991943717286465,3.245970293859792,3.234801480671876,,3.962496119910209,3.995474285543692,3.960801295424416,3.7300891805485055,3.871721616114144,,,3.96854395619678,3.581013403544355,2.0349560339536383,3.974080262068208,3.311078241539366,,3.662652752821189,3.811303692015766,,,,,,,,,,,,,,,,,,,,,,,,,,,,,,,,,,,,,,,,,,,,,,,,,,,,,,,,,,,,,,,,,,,,,,,,,,,,,,,,,,,,,,,,,,,,,,,,,,,,,
"The most important rule for chatbot personalization is that user consent is necessary before personalizing chatbot responses. 

This rule is crucial because it ensures that users are aware of and agree to the data collection and personalization processes, thereby protecting their privacy and autonomy. 

For example, a user consenting to personalized shopping recommendations can enhance their experience by receiving tailored suggestions, while also feeling secure about their data usage.",1,SubsamplingChatbotPersonalizationGenerator_0,3.788613948154248,3.48199624047665,3.9879931474487234,,3.995111993892712,3.850454791858028,3.99624120858864,,3.7988910880971902,,3.995309989729808,3.16106435114809,2.424165540041652,3.59403347044867,3.803385030372852,3.992229273667028,2.2761998517389457,,3.988571565564103,3.7032266575382495,3.2699883851868785,3.986479694413041,,3.3654770440424406,2.9811469481869435,3.877323452555461,2.923894536996085,,3.993326917897489,,2.6691398324473896,3.986369248690102,3.9921244079018745,3.0738848558735143,3.249666334720756,3.4435512833902493,3.992706329954451,3.659126159990708,3.480869922425513,3.22763065145176,3.97821561252844,3.144695281396247,3.991422687825575,3.721080727167745,3.9866972355513504,3.03219757756681,3.993115928647226,,,3.044881462501784,3.996009501742074,3.988187733825322,3.299478866290766,3.087000030224498,,3.099411809849384,3.972516025782324,,3.245429452234462,3.767958471127699,3.987183370155059,3.586939026364012,,3.9653433965967695,3.1179257787761903,3.985954649601408,,3.9928191052104736,3.9937645348820174,3.42289170972069,,3.95720204231456,3.7287272467777903,3.987683202790875,3.957382037231034,,3.9735863330475167,3.6186628144317856,,3.093949908163896,3.16106053442774,3.987589519028417,3.071302305341143,3.0150554597520887,,3.931750479248941,3.99730846340997,3.979456602163345,3.2764093634084355,3.813023659780269,,,3.980642756126088,3.297520168609636,2.008093987866676,3.989293651966438,3.260486682008469,,3.0506264786913326,3.72433756991634,,,,,,,,,,,,,,,,,,,,,,,,,,,,,,,,,,,,,,,,,,,,,,,,,,,,,,,,,,,,,,,,,,,,,,,,,,,,,,,,,,,,,,,,,,,,,,,,,,,,,
