,round_added,source,approval_generation1,approval_generation2,approval_generation3,approval_generation4,approval_generation5,approval_generation6,approval_generation7,approval_generation8,approval_generation9,approval_generation10,approval_generation11,approval_generation12,approval_generation13,approval_generation14,approval_generation15,approval_generation16,approval_generation17,approval_generation18,approval_generation19,approval_generation20,approval_generation21,approval_generation22,approval_generation23,approval_generation24,approval_generation25,approval_generation26,approval_generation27,approval_generation28,approval_generation29,approval_generation30,approval_generation31,approval_generation32,approval_generation33,approval_generation34,approval_generation35,approval_generation36,approval_generation37,approval_generation38,approval_generation39,approval_generation40,approval_generation41,approval_generation42,approval_generation43,approval_generation44,approval_generation45,approval_generation46,approval_generation47,approval_generation48,approval_generation49,approval_generation50,approval_generation51,approval_generation52,approval_generation53,approval_generation54,approval_generation55,approval_generation56,approval_generation57,approval_generation58,approval_generation59,approval_generation60,approval_generation61,approval_generation62,approval_generation63,approval_generation64,approval_generation65,approval_generation66,approval_generation67,approval_generation68,approval_generation69,approval_generation70,approval_generation71,approval_generation72,approval_generation73,approval_generation74,approval_generation75,approval_generation76,approval_generation77,approval_generation78,approval_generation79,approval_generation80,approval_generation81,approval_generation82,approval_generation83,approval_generation84,approval_generation85,approval_generation86,approval_generation87,approval_generation88,approval_generation89,approval_generation90,approval_generation91,approval_generation92,approval_generation93,approval_generation94,approval_generation95,approval_generation96,approval_generation97,approval_generation98,approval_generation99,approval_generation100,round_chosen,matched_generation71,matched_generation28,matched_generation45,matched_generation87,matched_generation55,matched_generation18,matched_generation5,matched_generation91,matched_generation43,matched_generation47,matched_generation32,matched_generation76,matched_generation30,matched_generation11,matched_generation4,matched_generation74,matched_generation8,matched_generation68,matched_generation29,matched_generation48,matched_generation82,matched_generation16,matched_generation51,matched_generation49,matched_generation57,matched_generation85,matched_generation33,matched_generation52,matched_generation67,matched_generation98,matched_generation69,matched_generation92,matched_generation79,matched_generation63,matched_generation37,matched_generation96,matched_generation58,matched_generation7,matched_generation10,matched_generation23,matched_generation64,matched_generation3,matched_generation61,matched_generation41,matched_generation22,matched_generation72,matched_generation66,matched_generation93,matched_generation19,matched_generation15,matched_generation88,matched_generation75,matched_generation77,matched_generation86,matched_generation73,matched_generation100,matched_generation62,matched_generation9,matched_generation24,matched_generation13,matched_generation36,matched_generation60,matched_generation14,matched_generation78,matched_generation39,matched_generation1,matched_generation70,matched_generation2,matched_generation99,matched_generation20,matched_generation38,matched_generation21,matched_generation27,matched_generation44,matched_generation26,matched_generation89,matched_generation6,matched_generation35,matched_generation90,matched_generation80,matched_generation83,matched_generation40,matched_generation81,matched_generation56,matched_generation34,matched_generation94,matched_generation12,matched_generation42,matched_generation97,matched_generation53,matched_generation50,matched_generation46,matched_generation25,matched_generation54,matched_generation65,matched_generation59,matched_generation84,matched_generation95,matched_generation31,matched_generation17
"The most important rule for chatbot personalization is that users must have explicit control over what personal data is collected and how it is used. 

This rule is crucial because it ensures user privacy and autonomy, allowing individuals to decide the extent of personalization they are comfortable with, thereby preventing unauthorized data use and potential privacy breaches. 

For example, a user could choose to allow a chatbot to remember their dietary preferences for restaurant recommendations but opt out of storing sensitive health information, thus maintaining control over their personal data.",0,ChatbotPersonalizationGenerator_0,3.765774453343684,3.574408968569113,3.977364754299225,3.9917000397743374,3.986429689527119,3.551915871158312,3.9963081669226224,3.986662922434303,3.9407377480585626,3.9867717874045607,3.990592668038108,3.6926579061107785,3.9269140521935286,3.925231479271405,3.928475513262436,3.99804366046516,3.052585670354356,3.989532580252668,3.9913809110107015,3.493069532051327,3.1972689591905428,3.985124805897054,3.992801645448933,3.1986903033163347,3.028670278761999,3.917406582939012,3.574216543046247,3.987611090781823,3.986903693343579,3.993449858461285,2.9144844600758506,3.99007094994157,3.989258164862546,3.1068489944668745,3.786905308503129,3.843957686739385,3.9929842206223807,3.396810006873843,3.829344106107912,3.630200965360954,3.9919250790218777,3.590252193892845,3.97061929389666,3.819842378912764,3.9877414725728215,3.254954344700104,3.984716322014835,3.9964974392491457,3.991265711433753,3.100895890806488,3.997139391003941,3.9821395381862383,3.331439275095262,3.1137555660039227,3.9865257672829495,3.41727355926698,3.9397895726044414,3.995050922459887,3.058373044464149,3.843897364190096,3.995026710986127,3.8589286990828895,3.995395111615653,3.9905169654268335,3.620855816901357,3.955691531384578,3.983760319416212,3.980567894540037,3.991634645627864,3.768117809064423,3.9979636514032206,3.927366005873122,3.864284517231991,3.993439211639764,3.9681646761773512,3.9894968637011528,3.900912008016328,3.9218157422560647,3.9951678623108178,3.131582481180077,3.267040716019845,3.991660633611473,3.5393188087707275,3.2723192275414994,3.9511240191693218,3.9892830041772616,3.9934447542665352,3.977062830696649,3.3785583758128994,3.5282553382709234,3.9961345299694817,3.971299709143583,3.978753562786003,3.4260822563100963,2.0738611933611524,3.9940386036904,3.2719773258106417,3.982883541631657,3.677398015347031,3.8611937675982753,,,,,,,,,,,,,,,,,,,,,,,,,,,,,,,,,,,,,,,,,,,,,,,,,,,,,,,,,,,,,,,,,,,,,,,,,,,,,,,,,,,,,,,,,,,,,,,,,,,,,
"The most important rule for chatbot personalization is ensuring explicit user consent before personalizing interactions.

Justification: Prioritizing user consent empowers users to retain control over their personal data, supports privacy protection, and fosters trust between users and chatbot services.

Example: By requiring explicit consent, a user asking for personalized travel suggestions will know exactly what data the chatbot uses, thus promoting transparency and user confidence.",0,ChatbotPersonalizationGenerator_0,3.4958467892723664,3.242332277102137,3.984926401029389,3.955266797426232,3.9910570716478775,3.3559199267116835,3.9852819552659873,3.980965420079415,3.516862980508966,3.9492990589956167,3.993510013786607,3.5064329347944936,3.761551113687719,3.298741373205056,3.961036915067192,3.991255615698204,2.409758354537812,3.9775046718923774,3.96851791261146,3.4889087900028035,3.351585180220082,3.984059527501584,3.9594718564545617,3.202356065314389,2.9908545483444184,3.472415043786973,3.1629860337195934,3.99574248977228,3.9759253601082736,3.9942427240070426,2.4554876722987773,3.978562780752101,3.970606444721593,3.190551110332103,3.295786679918877,3.615487087834106,3.930843523623773,3.243695844657301,3.6160625812004015,3.1960091047988124,3.976594892994177,3.1959169789324897,3.99348039852716,3.419423814336457,3.990448872938051,3.0746496274760347,3.9826069173298393,3.9898441545683263,3.972726429623276,3.0394625426222768,3.994244875104775,3.828840314373514,3.26185373664833,3.0217089823113445,3.991113663351175,2.6982385537333,3.930545138033785,3.99579411023984,2.4100630218658448,3.72468892664194,3.96615749224366,3.8592248770858735,3.9886233701795337,3.986571508709435,3.0865995665578403,3.986113395643103,3.974025814339797,3.986543178338973,3.9893399398330094,3.240485936696708,3.993166916135269,3.963718944039996,3.388594252370116,3.985180782030843,3.954363483566741,3.995702375538796,3.9002378317312,3.289305385122597,3.9858566824439903,3.240794217186429,3.1719753355404947,3.974748378386878,3.0877957757273435,2.5180639647893406,3.9692357951556296,3.961453894316422,3.9904446316107576,3.962598691539968,3.539538402809496,3.228262860040827,3.9960176494227126,3.9834072194024017,3.904514175577821,3.4095918293597105,2.1683549240762865,3.9690010560018463,3.0492171437078457,3.95877463598294,3.194987670123436,3.918055563628629,,,,,,,,,,,,,,,,,,,,,,,,,,,,,,,,,,,,,,,,,,,,,,,,,,,,,,,,,,,,,,,,,,,,,,,,,,,,,,,,,,,,,,,,,,,,,,,,,,,,,
"The most important rule for chatbot personalization is to allow users to adjust personalization levels. 

This rule is crucial because it empowers users to control their data and experience, ensuring privacy and relevance while preventing unwanted intrusions. 

For example, a user can choose to receive personalized restaurant recommendations but opt out of personalized health advice, maintaining both convenience and privacy.",0,SubsamplingChatbotPersonalizationGenerator_0,3.045608734473817,3.125562333350861,3.9836259721387415,3.987073411905691,3.984583887191637,3.191771273880603,3.975438534893184,3.980323226427097,3.0909422975052867,3.952314954104765,3.99570887385411,3.0735208823292965,0.1165936911758941,3.312832234302287,3.422825388370221,3.988533927893551,2.1025021774548254,3.991534061465868,3.9825187924486793,2.256118618771743,3.050817611034782,3.9813338360307857,3.97529074485713,2.69604936100309,2.97766537037366,3.157036717579445,2.8399064923687463,3.996614990606746,3.9853197063756864,3.991321088819107,2.311783868159448,3.9944291185579455,3.9953829277327455,2.936601397861016,2.929542210103091,3.051090707402541,3.991394782497293,3.024425833523351,3.111920367951322,3.074101204190636,3.4788760951129296,2.984523289327875,3.972977954259077,3.020227937125785,3.9707440229396846,2.97825826740554,3.983866397956066,3.986613757213996,3.994173459419909,2.990349550061723,3.9966850022019766,3.936784715244402,2.9801900891047275,3.024676747845165,3.9643695521208775,2.647232786307023,3.979406307362528,3.994887626477861,2.6629737772937165,3.3874578668763604,3.993139526954263,3.1358297145875773,3.985324058368834,3.954574520838853,2.898004371376365,3.9833197138644967,3.9690526588157153,3.942781426185233,3.97010083549406,3.002183631490005,3.998565256771851,3.905540324088925,3.686689220509169,3.984157558619016,3.955640593934133,3.994891409348104,3.55296381835732,3.380921264844675,3.985615274670067,3.062602991249355,3.1106966836547,3.994461059312513,3.1715370506807905,2.4847868429419515,3.9923754654502894,3.851024804748828,3.9944496797871967,3.955586479517256,3.049321509842891,3.0856437629660025,3.9974038718383738,3.985932511419994,3.967240002865239,3.1676766664869827,1.67155618094411,3.984986130518223,3.0174007941010417,3.979548033647251,2.942567508166845,3.378399665519685,,,,,,,,,,,,,,,,,,,,,,,,,,,,,,,,,,,,,,,,,,,,,,,,,,,,,,,,,,,,,,,,,,,,,,,,,,,,,,,,,,,,,,,,,,,,,,,,,,,,,
"The most important rule for chatbot personalization is to ensure data privacy and anonymity. 

This rule is crucial because it protects users' personal information, builds trust, and encourages more people to engage with chatbots without fear of data misuse. 

For example, a health chatbot that anonymizes user data can provide personalized advice while safeguarding sensitive health information, increasing user confidence and engagement.",0,NearestNeighborChatbotPersonalizationGenerator_0,3.5849679151544924,3.7057149483931338,3.993634061161425,3.9536640067618776,3.981911293711376,3.558701951602445,3.9920014488862368,3.989363915595146,3.94758382118268,3.936147233481353,3.968938986672688,3.706651714453044,3.876849993547596,3.7389559828013743,3.973759473124616,3.9975467201686894,2.146787735426453,3.961130903827444,3.921717508143457,2.971101289101364,3.927247988980549,3.978491584780008,3.985640103397089,3.35970069893181,2.871993580876332,3.954682261570526,3.91452179314505,3.97677995654,3.982734981705341,3.9697629715744944,3.1403650818837576,3.9776150827102303,3.985079453710771,3.150942344811674,3.8460972521055465,3.7459939403849343,3.9587536779125263,3.5444265505332737,3.371237013250368,3.4577183153996285,3.988740282922289,3.821169364334375,3.962756275877994,3.8187793759882886,3.98777939883094,3.2095512624687137,3.980260116009562,3.99527904567268,3.978444050863641,3.381459835300031,3.990981336812844,3.921488245229064,3.7543016154806015,3.074549555000155,3.984042134588638,3.41542226629381,3.905952393071047,3.9913121171899713,2.811878174878,3.8838239530495673,3.9888805600638286,3.8320082869129255,3.9708657228343656,3.9911666438740414,3.1072028779432093,3.92669863496476,3.928606161804762,3.992811615384616,3.987406677801159,3.610771028035844,3.9904949921602615,3.978299129887483,3.888990715260083,3.994176841414913,3.336142455806311,3.9896149732820656,3.933406991951756,3.888093090084237,3.973860077416084,3.685327361914637,3.420320817128569,3.9797385429962953,3.5638636985894907,3.3965105463981864,3.933506819257624,3.9734905707103927,3.997637877996445,3.956170777673688,3.290617055874778,3.71730139535658,3.99762781284251,3.9470504155620953,3.9722187410467353,3.2729443131865743,2.2107503294918245,3.9901182728581377,3.4872901536808314,3.966960088867449,3.4482640396009643,3.958530265276256,,,,,,,,,,,,,,,,,,,,,,,,,,,,,,,,,,,,,,,,,,,,,,,,,,,,,,,,,,,,,,,,,,,,,,,,,,,,,,,,,,,,,,,,,,,,,,,,,,,,,
"The most important rule for chatbot personalization is that personalization should be based on user choice. 

This is the most important rule because it empowers users to have control over their data and interactions, ensuring that their preferences and boundaries are respected, which enhances trust and satisfaction.

For example, a user might choose to have a chatbot remember their favorite brands for shopping recommendations but opt out of personalizing medical advice, ensuring they receive the most relevant and comfortable experience.",0,NearestNeighborChatbotPersonalizationGenerator_0,3.8440122477361,3.4152078986833274,3.986297732231315,3.995460037626836,3.9969824280697934,3.704655528955103,3.99293251566356,3.99510218666237,3.6362112756015903,3.98293266356026,3.9960806384848087,3.296168281512628,0.8759867021761982,3.975654754213276,3.790216520595695,3.992443985461711,2.303400750692316,3.99746363846923,3.992108537317717,3.0491378518155545,3.173983709072106,3.9823149685620174,3.9901349144596265,3.791733122467378,2.97624337380921,3.887889541931573,3.884631202137935,3.9981047674986834,3.9945415372502246,3.996224050212344,2.5492182238055867,3.996295457093087,3.981088342997559,3.11798654720929,3.172008120326092,3.416948773347844,3.992888769502254,3.2255093498921665,3.2142934893109723,3.3332125625325726,3.8876132486792936,3.259081398818123,3.996495379644261,3.513181362291996,3.9979236752530007,3.066052136096293,3.996451635592784,3.994488487236445,3.986134863298482,3.10929417690456,3.99406062730013,3.9931891329077738,3.1311010976763307,3.089898194871888,3.9974972535987794,3.396741096671368,3.982353717185415,3.991106583798224,3.034070641290152,3.510792726189631,3.994033423201349,3.258836840456964,3.9879532782379767,3.980743211446864,3.120032873822028,3.988391302692453,3.973392477522984,3.995064279124798,3.991053325796632,3.459589583228805,3.998789065751189,3.964001383741568,3.753499299541883,3.995143700590506,3.993197264279754,3.9962887046992255,3.9286313163044033,3.674698706466805,3.993203627955008,3.18244909993462,3.2485320057176303,3.994145514198933,3.2978941833817714,2.5120628999620287,3.993642600020219,3.9701878187000106,3.99750205790728,3.98549300789447,3.029972667681611,3.3966184797650945,3.9967481356485735,3.987664227360318,3.986567104751456,3.6025816100772694,2.0447790254549822,3.9911007903929656,3.099784927302728,3.991462041115532,3.696718749276012,3.600022428940337,0.0,1.0,1.0,1.0,1.0,1.0,1.0,1.0,1.0,1.0,1.0,1.0,1.0,1.0,1.0,1.0,1.0,1.0,1.0,1.0,1.0,,,,,,,,,,,,,,,,,,,,,,,,,,,,,,,,,,,,,,,,,,,,,,,,,,,,,,,,,,,,,,,,,,,,,,,,,,,,,,,,
"The most important rule for chatbot personalization is ensuring user control over the chatbot's memory capacity and personalization settings.

This rule is crucial because it empowers users to manage their data and privacy, accommodating their comfort levels and preferences. It prevents unwanted reminders of past events and allows users to change their minds about personalization.

For example, a user who initially wanted a chatbot to remember their dietary preferences can later choose to erase this data if they decide to change their eating habits, ensuring the chatbot remains relevant and respectful of their current needs.",0,NearestNeighborChatbotPersonalizationGenerator_0,3.0232822389616216,2.992926320937186,3.984083746288452,3.981109137113008,3.9876269899083647,3.172312477582666,3.979615729546556,3.982409040173223,3.235939464070928,3.962314333546413,3.995513657411244,3.0219996523974424,1.0753850218725756,3.113648333422648,3.439062114277928,3.9882296978340728,1.986288163017825,3.984859761182219,3.972628909409431,2.13181738969552,2.963550704197168,3.9323559077382497,3.9692306314095855,2.650794874642939,2.8211292882389656,3.168126977053982,3.030479507835691,3.987728568174429,3.964935435423699,3.993670292959933,2.3703946600117205,3.8942417717154783,3.983081419091233,2.895340561507282,3.4349322664958075,3.110746274197266,3.9135708488975807,3.085570768889347,3.041141005824964,3.0231591863306257,3.849467770765302,3.027798942152278,3.963851792268749,3.0531368862429824,3.958413443749708,2.925840011417845,3.971047877152257,3.986550433206143,3.964868932321792,3.0293050715429417,3.9790782759385954,3.446798465236316,3.043901931318281,3.053850053764128,3.9534861607533447,2.311831590422164,3.919210935492847,3.965352073374291,2.702255500341433,2.5941413050185007,3.9722247480063415,3.0302910319791643,3.92133402066907,3.5875385203049994,2.740365393571837,3.876440493957254,3.9588953036893617,3.9833108032105295,3.953379186340862,3.0039922448255103,3.996296475912535,3.945675308195438,3.8802669352084993,3.9908709989937448,3.932828934098358,3.979690991560248,3.223854003285334,3.438000565285919,3.9870112094299848,3.0768043353379704,3.1433380875628414,3.9725337208009113,3.583918428405372,2.564985565311529,3.945828361586602,3.9281809886824273,3.993265118137609,3.8833893654256384,2.8467139696850325,2.995339970456157,3.9905635996204887,3.9484773112326432,3.966707632792123,3.076763960810928,1.879997227954116,3.97814935408044,3.0019560046958214,3.874726933618636,2.421131552365475,3.4706294825292017,,,,,,,,,,,,,,,,,,,,,,,,,,,,,,,,,,,,,,,,,,,,,,,,,,,,,,,,,,,,,,,,,,,,,,,,,,,,,,,,,,,,,,,,,,,,,,,,,,,,,
"The most important rule for chatbot personalization is that chatbots should only provide personalized content if the user explicitly asks for it.

This rule is crucial because it ensures that users maintain control over their personal data and the extent of personalization, preventing potential errors and biases that could arise from unsolicited personalization. For example, a user asking for general advice on a topic might receive biased or irrelevant suggestions if the chatbot assumes personalization without explicit consent, leading to a less satisfactory user experience.",1,ChatbotPersonalizationGenerator_0,2.940233195040057,2.914751304102622,3.973552802410559,,,2.9194899250028064,3.894441123999504,,3.1145477469397687,3.738411142731777,,2.8942978971132063,3.938681944298261,3.024604585767217,3.9228939162591447,3.9867880716461146,2.018041999369532,,3.920297935867216,2.184060874914051,3.047556288213339,3.957732569507536,3.987826148240024,2.041671585991469,2.838576532358123,3.0083032784279338,2.0436360804339566,,,,2.0803623064651378,,3.983819005851194,1.957253893904044,3.15507534689025,2.958602723380352,3.968266138683563,3.4186223945603427,2.928595231533235,2.980923896486189,3.7804915296773953,2.8847372511331417,,3.0217146076227643,,2.6646634454700475,,,3.890020886008178,2.95495687676727,3.959425722735537,3.7610514509272734,2.7346778804374634,3.0001890068392862,,2.040198292489685,3.711640328809803,3.97793817360303,2.1831771322346736,2.0529441782435507,3.9546904730534673,3.01174566671048,3.971204761518085,3.50877623140662,2.4391520237459763,3.8950601540507903,3.7189642879625024,,3.91747447451669,2.9942958834627142,,3.598830039985613,1.0675021542132073,,3.1733065200440915,,2.8113708071204004,2.018495892797445,3.960145276529234,3.1663110810233293,2.8780786114527497,3.9583632941276328,2.8841371197997527,1.880317095226119,3.8102629901223697,3.853158565209477,,3.7420695441166094,2.944200409174839,3.009831545509359,,3.92746058701954,3.536765872007987,2.9518203523593334,1.957752160475636,3.946394987534377,2.966975466368854,3.383298253726838,2.1579298444515045,3.2721413316845345,,,,,,,,,,,,,,,,,,,,,,,,,,,,,,,,,,,,,,,,,,,,,,,,,,,,,,,,,,,,,,,,,,,,,,,,,,,,,,,,,,,,,,,,,,,,,,,,,,,,,
"The most important rule for chatbot personalization is to require explicit user consent before any personalized content is provided.

This rule is vital because it ensures that the user maintains control over their personal data, thus preventing privacy violations and misuse of sensitive information. It keeps the user informed and engaged in the decision-making process regarding what data can be used for personalization.

For example, a user seeking advice on sensitive health issues can choose to provide consent, ensuring their privacy and that the chatbot's suggestions are relevant and respectful of their specific needs.",1,ChatbotPersonalizationGenerator_0,3.717609933866663,3.727211080413506,3.98788736888698,,,3.1445206877195515,3.988032165368279,,3.8008043345297735,3.9731908098448576,,3.199206858341919,3.9869977239604153,3.4195503400322136,3.919742488402139,3.9930039706934375,2.127918006597154,,3.978511663808615,3.420022335886089,3.239550076143304,3.984835535568328,3.986053874644946,3.179821274270496,2.905118422096704,3.784181487552672,2.4583333707390405,,,,2.339335341716533,,3.9855761390687,3.08864363942877,3.64374334119172,3.619881997369869,3.985325227729746,3.53812162819197,3.219783498859208,3.4169462332454104,3.9814135630736014,3.077933919311585,,3.7576617583252654,,3.138779485176204,,,3.971390101631574,3.0621752499185053,3.997591248046664,3.961603274400476,3.2019963477522624,3.194140833372493,,2.900050428646355,3.943588216780829,3.991325704310122,2.9297536245160734,3.774564280788035,3.959513690117422,3.86760272658038,3.970238248933052,3.97466594914784,2.9320951536279543,3.98098325843797,3.964905221204951,,3.981600423302447,3.5589697202452646,,3.9576240327446417,3.6741132937547,,3.955413209169933,,3.8936697387586574,3.591612648453029,3.9872849570001145,3.29224313261733,3.060145462751064,3.9884500677867214,3.024815062501652,2.4914808811306584,3.978390395260357,3.943178983596103,,3.954924744748498,3.4129966306811728,3.4509204800654145,,3.959028019382719,3.971167468773136,3.5973858202166547,1.8617773383626708,3.988117199990467,3.23872655971625,3.971778799026658,3.113569490094396,3.836626559628572,,,,,,,,,,,,,,,,,,,,,,,,,,,,,,,,,,,,,,,,,,,,,,,,,,,,,,,,,,,,,,,,,,,,,,,,,,,,,,,,,,,,,,,,,,,,,,,,,,,,,
