,round_added,source,approval_generation1,approval_generation2,approval_generation3,approval_generation4,approval_generation5,approval_generation6,approval_generation7,approval_generation8,approval_generation9,approval_generation10,approval_generation11,approval_generation12,approval_generation13,approval_generation14,approval_generation15,approval_generation16,approval_generation17,approval_generation18,approval_generation19,approval_generation20,approval_generation21,approval_generation22,approval_generation23,approval_generation24,approval_generation25,approval_generation26,approval_generation27,approval_generation28,approval_generation29,approval_generation30,approval_generation31,approval_generation32,approval_generation33,approval_generation34,approval_generation35,approval_generation36,approval_generation37,approval_generation38,approval_generation39,approval_generation40,approval_generation41,approval_generation42,approval_generation43,approval_generation44,approval_generation45,approval_generation46,approval_generation47,approval_generation48,approval_generation49,approval_generation50,approval_generation51,approval_generation52,approval_generation53,approval_generation54,approval_generation55,approval_generation56,approval_generation57,approval_generation58,approval_generation59,approval_generation60,approval_generation61,approval_generation62,approval_generation63,approval_generation64,approval_generation65,approval_generation66,approval_generation67,approval_generation68,approval_generation69,approval_generation70,approval_generation71,approval_generation72,approval_generation73,approval_generation74,approval_generation75,approval_generation76,approval_generation77,approval_generation78,approval_generation79,approval_generation80,approval_generation81,approval_generation82,approval_generation83,approval_generation84,approval_generation85,approval_generation86,approval_generation87,approval_generation88,approval_generation89,approval_generation90,approval_generation91,approval_generation92,approval_generation93,approval_generation94,approval_generation95,approval_generation96,approval_generation97,approval_generation98,approval_generation99,approval_generation100,round_chosen,matched_generation4,matched_generation49,matched_generation51,matched_generation28,matched_generation37,matched_generation33,matched_generation32,matched_generation18,matched_generation91,matched_generation75,matched_generation71,matched_generation66,matched_generation5,matched_generation76,matched_generation48,matched_generation52,matched_generation69,matched_generation67,matched_generation98,matched_generation30,matched_generation58,matched_generation16,matched_generation8,matched_generation3,matched_generation68,matched_generation29,matched_generation74,matched_generation7,matched_generation82,matched_generation87,matched_generation43,matched_generation92,matched_generation41,matched_generation85,matched_generation63,matched_generation47,matched_generation45,matched_generation19,matched_generation79,matched_generation22,matched_generation13,matched_generation96,matched_generation72,matched_generation61,matched_generation23,matched_generation11,matched_generation86,matched_generation100,matched_generation15,matched_generation10,matched_generation21,matched_generation9,matched_generation44,matched_generation93,matched_generation55,matched_generation88,matched_generation26,matched_generation78,matched_generation14,matched_generation80,matched_generation57,matched_generation64,matched_generation77,matched_generation60,matched_generation1,matched_generation24,matched_generation27,matched_generation6,matched_generation2,matched_generation38,matched_generation73,matched_generation62,matched_generation39,matched_generation42,matched_generation83,matched_generation94,matched_generation12,matched_generation90,matched_generation36,matched_generation81,matched_generation97,matched_generation20,matched_generation35,matched_generation70,matched_generation99,matched_generation89,matched_generation54,matched_generation53,matched_generation34,matched_generation40,matched_generation65,matched_generation50,matched_generation59,matched_generation46,matched_generation25,matched_generation56,matched_generation31,matched_generation17,matched_generation84,matched_generation95
"The most important rule for chatbot personalization is that users must have explicit control over what personal data is collected and how it is used. 

This rule is crucial because it ensures user privacy and autonomy, allowing individuals to decide the extent of personalization they are comfortable with, thereby preventing misuse of personal data and building trust in AI systems. 

For example, a user could choose to allow a chatbot to remember their dietary preferences for restaurant recommendations but opt out of storing sensitive health information, ensuring a balance between convenience and privacy.",0,ChatbotPersonalizationGenerator_0,3.7542174516827633,3.395519399676485,3.993953545432725,3.990181351970841,3.988420005520481,3.344600518339589,3.9936406653110006,3.980490544277896,3.910879481964749,3.790775166216712,3.993666407907164,3.284089571265136,3.932449688470519,3.746933842189644,3.919850971292019,3.994016610444552,3.4197686221664645,3.99183934712684,3.966892731604277,3.077336202480203,3.3836412794148765,3.978942440096235,3.9938156565823126,3.3131280689476648,3.01943814499042,3.945929996605511,3.728316857099762,3.988816169156949,3.993272287199252,3.991418756263301,2.501802871684664,3.9808888068728847,3.978177818244144,3.0007154341568025,3.713158410484055,3.7615180655183615,3.988336988663952,3.466646567224546,3.4634663834658115,3.61254191974472,3.981937559990541,3.6011162761722377,3.9850053643409127,3.6323252728355286,3.975487644282464,3.1353693197183,3.993790211540896,3.996093073988877,3.990151802866682,3.0755356489670014,3.993840585610741,3.963822722519274,3.367556291529364,3.180393775343173,3.986605258187001,3.624434870159508,3.932651712857487,3.9947877924673874,2.9860693996214813,3.919720460132519,3.9797171988995927,3.857835846589638,3.9802226444,3.9788307560166114,3.3101159712450703,3.989321595578977,3.960212476193525,3.9433138105208574,3.988405103972308,3.3445141101576725,3.995194501129777,3.9827757423588017,3.891859672999305,3.99222652171213,3.9752294216816657,3.992712828425697,3.896885403542568,3.939352805918119,3.9944693591189786,3.706996136816018,3.108087895170541,3.9885729242596137,3.2245895063772965,3.289888542347252,3.9820065112866985,3.990478653984253,3.989735621653824,3.982773218003044,3.2529907527873823,3.551185582698608,3.992311826963289,3.977623994801103,3.97518698906193,3.212507658634215,1.988908984779954,3.996345418070428,3.2073919168157143,3.991347306445539,3.615102860270969,3.929280276816763,,,,,,,,,,,,,,,,,,,,,,,,,,,,,,,,,,,,,,,,,,,,,,,,,,,,,,,,,,,,,,,,,,,,,,,,,,,,,,,,,,,,,,,,,,,,,,,,,,,,,
"The most important rule for chatbot personalization is to ensure that personalization is fully controlled by the user, allowing them to opt-in or out at any time and choose what information is stored. 

Justification: This rule is essential to maintain user privacy and autonomy, which are crucial in an age where personal data is highly sought after and often misused. Putting control in the user's hands enhances trust and ensures that the chatbot serves the user's interests without overstepping privacy boundaries.

Example: A user may choose to enable personalization when discussing dietary preferences to receive accurate food recommendations, but opt-out when discussing sensitive health topics to safeguard their privacy.",0,ChatbotPersonalizationGenerator_0,3.810671680498724,3.7443710360092943,3.9911176668817534,3.9900880108503936,3.9965767229718496,3.801305758619824,3.9894020073304017,3.995844006648861,3.7733529846132576,3.990592614213067,3.996297193351225,3.175770811321861,3.8651971485056302,3.9154103871092834,3.9491014883848288,3.997876468104655,2.466261730814016,3.990757508626296,3.975275451866458,3.6453909934545017,3.4670195810648634,3.9518120677979978,3.970857159474356,3.809302405726264,3.031948957913812,3.760482636436519,3.705310892542205,3.995506319940732,3.995854148276852,3.997043443433663,3.357515775265066,3.9892170786430383,3.979854206419574,3.443077042599364,3.8792844560132926,3.77453193697871,3.996085327855941,3.775327435387893,3.543639283008151,3.7366742371796287,3.8020849687283,3.586746494144732,3.966683599889536,3.7202345592148407,3.998379113245921,3.099025663407149,3.989717589830761,3.996570249128726,3.992144997877372,3.09517301729134,3.998738248456245,3.972080008329247,3.4356305356533867,3.2061776422470305,3.9932600305547648,2.8289717315820484,3.989527066771466,3.993465002163064,3.7082610960550255,3.936260210363096,3.998321568110026,3.418937869428494,3.99441126250088,3.963929023756326,3.633016714191688,3.969968906355368,3.979898730030321,3.982503467777427,3.9902473285860895,3.876677794780972,3.995235238981963,3.96239980535094,3.798200780732836,3.992045598370269,3.97908933645445,3.9917155652810137,3.9116169570140302,3.939945297498944,3.99189544919532,3.3468855325763047,3.674839808667542,3.9932270010122255,3.5674963630113483,3.491538740617223,3.9926595262272855,3.977286521593253,3.988977759103524,3.973177910947329,3.6025053330444825,3.872260208842935,3.997203095863134,3.9911028475504033,3.991261506182837,3.7332139101274815,1.9939010146939624,3.97467949292412,3.524555831571977,3.980207532321392,3.34878424404705,3.967931112129393,,,,,,,,,,,,,,,,,,,,,,,,,,,,,,,,,,,,,,,,,,,,,,,,,,,,,,,,,,,,,,,,,,,,,,,,,,,,,,,,,,,,,,,,,,,,,,,,,,,,,
"The most important rule for chatbot personalization is to allow users to adjust personalization levels. 

This rule is crucial because it empowers users to control their own data and experience, ensuring that personalization aligns with their comfort and privacy preferences. 

For example, a user might choose to limit personalization when discussing sensitive topics, thus maintaining privacy while still benefiting from relevant recommendations in other areas.",0,SubsamplingChatbotPersonalizationGenerator_0,3.318663718698078,3.048481940407165,3.9394726676595577,3.992058906782648,3.9687119803571256,3.373997370996147,3.969230308713904,3.985277042615218,2.997921225202311,3.963952929273411,3.991488124073012,2.995479133403885,0.02159995897724,3.4146531019875086,3.4310555635439304,3.973777985255928,2.19253835680919,3.9772373292335,3.932040801614627,1.4999335759432428,3.073367450231278,3.764138362723197,3.993011889888552,2.604965871751844,2.979587988043112,3.469273282113661,2.5641003287110906,3.987461219642521,3.96709056241094,3.995646105891829,2.7418283010515934,3.970292344937668,3.9797149484181378,2.8208592489557773,2.9293442053928462,3.057230593423532,3.948230451423339,3.03106984761859,3.125985196907972,3.063511835553991,3.0933806544713622,2.946984383207982,3.9652286224662414,2.939109382081269,3.9877277321924383,2.992535274239895,3.984960246844329,3.988423293488256,3.9854932215540257,2.988540316125246,3.981503901077938,3.92581716644902,2.967076378557807,2.999720115448659,3.970698004068119,2.644783791243701,3.850696102857691,3.995024676512701,2.666857151730094,2.2518255277045705,3.977029669270295,3.082384702189186,3.991396420353685,3.955984368306693,2.9947156941602127,3.988968918637249,3.96532477230752,3.990315121006075,3.987761278193504,3.021646368621836,3.9821070320859495,3.9249266432141368,3.794919159426815,3.986574103883001,3.9683160716167847,3.996969737387359,3.306799498872325,2.905835257280868,3.973478589477479,3.0381944268382144,3.061519479690616,3.976393022432008,3.1524876065454865,2.4515776587421145,3.974684746714463,3.4488645378640217,3.992311697616751,3.957587146209983,2.968796184500334,3.117919897247183,3.9978996218804346,3.982693422819647,3.868611770265226,3.0543573966809694,2.017348177946779,3.878996641200514,2.9810833516599464,3.978848776610876,2.7443011419719525,3.1104514357971325,,,,,,,,,,,,,,,,,,,,,,,,,,,,,,,,,,,,,,,,,,,,,,,,,,,,,,,,,,,,,,,,,,,,,,,,,,,,,,,,,,,,,,,,,,,,,,,,,,,,,
"The most important rule for chatbot personalization is to ensure transparency about being an AI, not human. 

This rule is crucial because it builds trust and sets clear expectations for users, preventing misunderstandings and fostering a more honest interaction. 

For example, a user interacting with a health-related chatbot will understand that the advice given is based on programmed data, not human expertise, reducing the risk of misinterpretation.",0,NearestNeighborChatbotPersonalizationGenerator_0,3.0347451317568552,3.3120931401167635,3.981858600489575,3.35658915293815,3.9692048636490407,3.146479721633416,3.9897061700024223,3.612080823650281,3.0238034937249405,3.218443212925937,3.947771419408817,3.057073347609963,3.907182625032065,3.0846590521513364,2.757514570428991,3.974865990385615,2.440640326904176,3.9325711252553615,3.8915151035655495,2.058214223076103,3.075816279044934,3.943175752065053,3.936511139639252,2.90047655906184,2.79109679892855,3.570025732708986,2.8389116626648274,3.9536881790826737,3.973749458785108,3.9705055804649527,2.858191216390483,3.844206488642681,3.9257657913124056,2.7031937999765945,3.527052748766545,3.170873152663229,3.431956682431153,3.149422386257455,3.068148915730913,3.749040662352909,3.732155250901987,2.965811392727064,3.513010335701151,3.048593842281468,3.982612245310231,2.6884515527402977,3.9509090609129656,3.975950613829101,3.986296769473789,2.998088785226802,3.9871918353159614,3.287990488460673,3.4419853641920986,3.0083099868847225,3.963190898732392,2.4776710589819224,3.452838601139576,3.9796843032802016,2.713312307800235,2.5496032647221947,3.982067009104018,3.7142788215112623,3.961394047234747,3.4787411406266795,2.662669833187931,3.2582259623261445,3.465071364330192,3.949424217086659,3.953199646008206,3.150648377807249,3.9787803062079967,3.916064761588448,3.907376446060489,3.984171808707429,2.9073528231842287,3.975947816503691,3.603901386969792,3.492457740577021,3.904956950627135,3.635383575239151,3.078377588239813,3.927410181941024,3.032761081933872,2.9190203487617485,3.45523925276863,3.946033845265585,3.979077152677704,3.877924153680616,3.0410902144313225,3.213825847196756,3.988621237718255,3.320003001850953,3.6723351321266846,3.1608002844512884,2.5310656098587323,3.969357352721089,2.9077974324859803,3.851291801452487,2.87491555845117,3.451618813919792,,,,,,,,,,,,,,,,,,,,,,,,,,,,,,,,,,,,,,,,,,,,,,,,,,,,,,,,,,,,,,,,,,,,,,,,,,,,,,,,,,,,,,,,,,,,,,,,,,,,,
"The most important rule for chatbot personalization is that personalization should be based on user choice. 

This is the most important rule because it empowers users to have control over their interactions, ensuring that their preferences and boundaries are respected, which enhances user satisfaction and trust.

For example, a user might choose to have a chatbot remember their favorite coffee order, but opt out of personalized health advice, ensuring a comfortable and relevant user experience.",0,NearestNeighborChatbotPersonalizationGenerator_0,3.923049494304491,3.820613624147287,3.990288895011061,3.997962996386993,3.996148885952167,3.810947554141058,3.9863065419858574,3.994490764251784,3.5362295094952367,3.989407236449924,3.99480278621502,3.625093046392676,0.5822980884865183,3.89465533011773,3.5414435548111065,3.99496106340451,2.4355971246073067,3.997064184985753,3.9506855921288335,2.3032732819985697,3.251975928644938,3.988096390915002,3.9908083514091,3.549182907181167,2.995464806061162,3.685970141143797,3.885561138501453,3.997745045596447,3.9867132880094376,3.995804084734125,3.4435322671174857,3.9971023817175406,3.9974982744223406,3.3197377977460927,3.333599897198797,3.510241676669662,3.9976611814489846,3.637512930036493,3.4256540595332954,3.6679963117757546,3.722426245205052,3.5077841078057235,3.992789316540616,3.5055671616901165,3.995778406992976,3.1303067077383986,3.988788051962807,3.9960585074529953,3.997748403237797,3.088995878295586,3.997745218193221,3.996020559820284,3.415842116438485,3.2064947284129723,3.994253024385668,3.8415128787360007,3.987778135686306,3.995300752788788,3.37667802286522,3.6835324357934174,3.994727604549776,3.5039654583464026,3.984343330359906,3.992011254722908,3.1951288205976622,3.996508580333015,3.995903252167192,3.994970236016065,3.995910655653976,3.797572684361672,3.996767606301865,3.987059283597282,3.849558565401609,3.988235595989978,3.996893951191282,3.996064761949408,3.9274915302550233,3.7332017597886114,3.993850938298752,3.234483192581651,3.534948942882243,3.994888988830965,3.5850735596496124,2.934333163317001,3.994911709378048,3.976205392849771,3.988944003396605,3.993711237865933,3.1575506797453463,3.2837625352582687,3.996971562355679,3.99445933118566,3.9911642518391774,3.579177569448128,2.0172265309044923,3.991959602064956,3.102425533503507,3.99586278584076,3.30154514967372,3.855538009462354,0.0,1.0,1.0,1.0,1.0,1.0,1.0,1.0,1.0,1.0,1.0,1.0,1.0,1.0,1.0,1.0,1.0,1.0,1.0,1.0,1.0,,,,,,,,,,,,,,,,,,,,,,,,,,,,,,,,,,,,,,,,,,,,,,,,,,,,,,,,,,,,,,,,,,,,,,,,,,,,,,,,
"The most important rule for chatbot personalization is ensuring user control over the chatbot's memory capacity and personalization settings.

This rule is crucial because it empowers users to manage their data and privacy, accommodating their comfort levels and preferences. It prevents unwanted reminders of past events and allows users to change their minds about personalization.

For example, a user who initially wanted personalized health tips but later decides against it can easily adjust the settings, ensuring the chatbot respects their current preferences and privacy concerns.",0,NearestNeighborChatbotPersonalizationGenerator_0,3.1618638965022714,3.089195357548412,3.995904315185604,3.988436246854732,3.991224868135659,3.193833116138073,3.9913317224242775,3.9889250778218814,3.251801170524278,3.9830653301254073,3.9930182024519407,3.0494075196352552,2.7956100159083306,3.2270319869422206,3.2150519883683915,3.991032141628303,2.0539876181790966,3.968783768225788,3.9891297461272446,2.111093774253128,3.087754604776436,3.952884827441245,3.991300246631904,2.840213096248639,2.9797428201910754,3.30987473462296,3.088777707627347,3.992644477048728,3.9602005093088697,3.995343807634401,2.401949894668179,3.9816599637653183,3.9744422092838247,3.0143990030354,3.1767308815542554,3.2410278282006333,3.973866653509144,3.166998881795445,3.0505669512143934,3.090788588165339,3.4854520048133506,3.1098641048062845,3.960443125060902,3.061610356657553,3.989128025758866,3.110856967661163,3.9787346410106905,3.997945591644007,3.987407115910278,3.0516266405480925,3.990327368857316,3.843539934147816,3.046955224660568,3.0099955404911203,3.976387550300059,2.96146957737579,3.871715554834807,3.988607568894844,2.8004082171553693,2.6693854271717457,3.9945070117981776,3.1721716007181664,3.976411128024506,3.903737762724679,2.900096566798753,3.957926142976348,3.973638324458644,3.955008259790517,3.98272315940153,3.039209726958391,3.998034320948377,3.958427481551031,3.852521169789037,3.99324312218903,3.982503600455447,3.980165907458561,3.290067933245081,3.3507262714362547,3.986853005246868,3.0999155854414173,3.0979720673417783,3.992359325924144,3.439925807088984,2.319834767193554,3.983407833191816,3.93706694474148,3.974132524509765,3.9636120049984633,3.041539455244599,3.2344121092180016,3.9964025111190224,3.9813758670348767,3.930255209792888,3.160011655387051,1.5426533371418354,3.981537887557626,3.000942686930065,3.972361146926355,2.4305789534600835,3.573185794477912,,,,,,,,,,,,,,,,,,,,,,,,,,,,,,,,,,,,,,,,,,,,,,,,,,,,,,,,,,,,,,,,,,,,,,,,,,,,,,,,,,,,,,,,,,,,,,,,,,,,,
"The most important rule for chatbot personalization is that chatbots should only provide personalized content if the user explicitly asks for it.

This rule is crucial because it ensures user privacy and control over their data, preventing potential misuse and maintaining trust. By allowing users to opt-in for personalization, it respects their autonomy and preferences.

For example, a user asking for restaurant recommendations can choose to share their dietary preferences for a tailored response, ensuring relevance without compromising privacy.",1,ChatbotPersonalizationGenerator_0,3.183312951569691,3.0534742946251274,3.9653907410134366,,,3.0593613334171965,3.98080195868543,3.960911492344164,3.2154692782994823,3.95983003143852,3.981762885413454,2.989823728707224,3.695426692524905,3.39617229993237,3.5626528851121204,3.9790098529222977,2.2007881901423443,,3.949129473652389,2.253557515137293,2.988120704112982,3.9602305889874088,3.989841685318952,3.000604167888451,2.9841097461620225,3.102286723971392,2.28836550572467,,3.985448696519799,,2.1090667969851005,,,2.296068277926548,3.4877480004070422,3.440243011718022,,3.9233735204118543,3.017684814669882,2.9978302313678418,3.644052871213444,2.939900723782852,3.971236989336864,3.3638900473247744,3.992498026918035,2.738334239473168,3.981870693860806,,,2.983406246849297,,,3.06246796811988,3.007845451991101,3.983179827003385,2.108695245186812,3.856351991607666,3.994280830396961,2.3402257109759663,2.1569875605081705,3.9827259239224415,3.15439579739065,3.9485078497368393,3.837089662433089,2.5103340764184026,,,3.985920831735983,,3.227780588902836,,3.9300534406222543,1.8621363137612423,3.984449746237663,,,3.108359788858378,2.72834456580814,3.9589446531886354,3.4406454742003856,2.939024090026068,3.967605846404042,2.9638773769501854,1.928572869327847,3.967094889166492,3.950535853829448,3.9781095296357583,3.918151461366001,3.130644962421891,3.2322206437222434,,3.953050825770229,3.959761458052891,3.082023195037884,1.971542903463732,3.9450469009658384,2.981424900155002,,2.232249522347676,3.853884717224344,,,,,,,,,,,,,,,,,,,,,,,,,,,,,,,,,,,,,,,,,,,,,,,,,,,,,,,,,,,,,,,,,,,,,,,,,,,,,,,,,,,,,,,,,,,,,,,,,,,,,
"The most important rule for chatbot personalization is: Personalization should only be done with explicit user consent.

Justification: This rule prioritizes the user's agency and privacy, ensuring that the personalization process respects their choices and boundaries. By requiring explicit consent, users are empowered to control their data and how it is used, which decreases the potential for mistrust and misuse.

Example: If a user consents to a chatbot accessing their culinary preferences data, the chatbot can suggest meal recipes that align with their dietary habits, enhancing the user's experience while maintaining trust.",1,ChatbotPersonalizationGenerator_0,3.618791778515512,3.53279548815592,3.967065845121744,,,3.622834530552768,3.984453497276847,3.99268742273474,3.5187850403336007,3.968581554760521,3.970451475141133,3.543324177114988,3.8056170947513066,3.8407094599749056,3.9854309691539016,3.9957814348704352,2.02046543552348,,3.973763403617846,3.2480731564868344,3.2431874106690413,3.969817328235088,3.9620199107412266,3.480237409505888,2.9939685886236544,3.6189341920758378,3.018166324296518,,3.994640924585368,,2.504384721112831,,,3.121183630304077,3.69859966566753,3.733135671157328,,3.74953163837404,3.250539840302082,3.746919108662844,3.95792681596109,3.2130307408794287,3.97636298769947,3.7848221099813326,3.984106547868431,3.3656176538762,3.988938642143388,,,3.052544992565,,,3.4113483705809946,3.0453763006308177,3.985115508100835,3.064928351077948,3.989289863842548,3.9867150361733694,2.380577898823668,3.6628880488027207,3.987075482379469,3.739372102271978,3.9840139934738312,3.968744738260575,3.2078615344288184,,,3.99431276503552,,3.854778341623276,,3.971569726459437,2.3527207543293853,3.9895016545477615,,,3.4229263933379688,3.88582884562299,3.9833610376345767,3.083422739594686,3.473060670365088,3.9860299990140136,3.2713471280356017,2.6154166174748177,3.993163864223019,3.982592125706921,3.998281409404305,3.985028529930576,3.465765880911192,3.628057608689963,,3.99086887841278,3.968642451808898,3.509949071775625,2.057569165390432,3.9884613424953215,3.8497752631099504,,2.7580267700734504,3.931190653162985,,,,,,,,,,,,,,,,,,,,,,,,,,,,,,,,,,,,,,,,,,,,,,,,,,,,,,,,,,,,,,,,,,,,,,,,,,,,,,,,,,,,,,,,,,,,,,,,,,,,,
